"Story","Title","Result","Date","Stability","Duration (s)"
"Login User","Login user with valid username, invalid password","SUCCESS","2019-08-02T16:21:41.079-04:00[America/Toronto]","0.0","10.1"
"Login User","Login user with valid username, empty password","SUCCESS","2019-08-02T16:21:52.916-04:00[America/Toronto]","0.0","14.4"
"Login User","Login user with valid username, valid password, remember me selected, account is enabled, account not expired, account not locked, credentials not expired","SUCCESS","2019-08-02T16:22:10.623-04:00[America/Toronto]","0.0","10.08"
"Login User","Login user with valid username, valid password, remember me not selected, account is enabled, account not expired, account not locked, credentials not expired","SUCCESS","2019-08-02T16:22:23.129-04:00[America/Toronto]","0.0","8.64"
"Login User","Login user with valid username, valid password, account is disabled","SUCCESS","2019-08-02T16:22:33.995-04:00[America/Toronto]","0.0","8.09"
